Id,Lesson,Slug,Description,Excerpt,Status,Module,Prerequisite,Preview,Tags,Image,Length,Complexity,Video,Pass Required,Passmark,Number Of Questions,Random Question Order,Auto-Grade,Quiz Reset,Allow Comments,Questions
69,Comparing Fractions Using the Number Line,,Understanding how to compare fractions on a number line in Grade 3 enhances comprehension of fraction sizes. Students will utilize the number line to compare fractions,Understand how to compare fractions on a number line,publish,Comparing Fractions,,,,,,,"<iframe width=""853"" height=""480"" src=""https://www.youtube.com/embed/KFxIXPSp6xg"" frameborder=""1"" allowfullscreen></iframe>",,,,,,,,
70,Comparing Fractions with Equal Denominators,,Learning to compare fractions with equal denominators in Grade 3 reinforces the understanding of fraction relationships. Students will explore how to compare fractions with the same denominator,Learn to compare fractions with equal denominators,publish,Comparing Fractions,,,,,,,"<iframe width=""853"" height=""480"" src=""https://www.youtube.com/embed/mPrL4msjEnY"" frameborder=""1"" allowfullscreen></iframe>",,,,,,,,
71,Comparing Fractions with Equal Numerators on the Number Line,,Exploring how to compare fractions with equal numerators on the number line in Grade 3 enhances understanding of fraction sizes. Students will utilize the number line to compare fractions with the same numerator,Explore how to compare fractions with equal numerators on the number line,publish,Comparing Fractions,,,,,,,"<iframe width=""853"" height=""480"" src=""https://www.youtube.com/embed/HoJfypsIkao"" frameborder=""1"" allowfullscreen></iframe>",,,,,,,,
72,Measuring Mass Using Units of Kilogram,,Learning to measure mass using kilograms in Grade 3 reinforces the understanding of weight and measurement. Students will explore how to use kilograms as a standard unit of measurement for mass,Learn to measure mass using kilograms,publish,Measurements: Masses and Liquid Volume,,,,,,,"<iframe width=""853"" height=""480"" src=""https://www.youtube.com/embed/Du-qEdxPC5Q"" frameborder=""1"" allowfullscreen></iframe>",,,,,,,,
73,Measuring Mass Using Units of Gram,,Understanding how to measure mass using grams in Grade 3 enhances skills in weight measurement. Students will learn to use grams as a metric unit of measurement for mass,Understand how to measure mass using grams,publish,Measurements: Masses and Liquid Volume,,,,,,,"<iframe width=""853"" height=""480"" src=""https://www.youtube.com/embed/GNcA-bD7F68"" frameborder=""1"" allowfullscreen></iframe>",,,,,,,,
74,Measuring Liquid Volume Using Units of Liter,,Learning to measure liquid volume using liters in Grade 3 reinforces the understanding of volume measurement. Students will explore how to use liters as a standard unit of measurement for liquid volume,Learn to measure liquid volume using liters,publish,Measurements: Masses and Liquid Volume,,,,,,,"<iframe width=""853"" height=""480"" src=""https://www.youtube.com/embed/CrFYdnWXgFE"" frameborder=""1"" allowfullscreen></iframe>",,,,,,,,
75,Estimating by Adding Whole Measurements of Weight,,Exploring estimation techniques for adding whole measurements of weight in Grade 3 enhances problem-solving skills. Students will learn to estimate the total weight of several objects by adding their approximate weights,Explore estimation techniques for adding whole measurements of weight,publish,Solving Problems Involving Masses or Volumes,,,,,,,"<iframe width=""853"" height=""480"" src=""https://www.youtube.com/embed/KccTZToKcSA"" frameborder=""1"" allowfullscreen></iframe>",,,,,,,,
76,Subtracting Whole Measurements of Weight,,Learning to subtract whole measurements of weight in Grade 3 reinforces skills in weight measurement and subtraction. Students will explore how to subtract the weight of several objects,Learn to subtract whole measurements of weight,publish,Solving Problems Involving Masses or Volumes,,,,,,,"<iframe width=""853"" height=""480"" src=""https://www.youtube.com/embed/qkzYluMUKB8"" frameborder=""1"" allowfullscreen></iframe>",,,,,,,,
77,Solving Mass Measurements Word Problems with Unit Fractions,,Applying unit fractions to solve word problems involving mass measurements in Grade 3 enhances problem-solving skills. Students will learn to use unit fractions to solve problems involving mass,Apply unit fractions to solve word problems involving mass measurements,publish,Solving Problems Involving Masses or Volumes,,,,,,,"<iframe width=""853"" height=""480"" src=""https://www.youtube.com/embed/B1GF5KGgSY8"" frameborder=""1"" allowfullscreen></iframe>",,,,,,,,
78,Multiplying Whole Measurements of Mass,,Learning to multiply whole measurements of mass in Grade 3 reinforces multiplication skills in real-world contexts. Students will explore how to multiply weights,Learn to multiply whole measurements of mass,publish,Solving Problems Involving Masses or Volumes,,,,,,,"<iframe width=""853"" height=""480"" src=""https://www.youtube.com/embed/Zcr7xdTP0oE"" frameborder=""1"" allowfullscreen></iframe>",,,,,,,,
79,Dividing Whole Measurements of Liquid Volume Using Groups,,Exploring division of whole measurements of liquid volume using groups in Grade 3 enhances understanding of division in practical scenarios. Students will learn to divide liquid volumes into equal parts using grouping strategies,Explore division of whole measurements of liquid volume using groups,publish,Solving Problems Involving Masses or Volumes,,,,,,,"<iframe width=""853"" height=""480"" src=""https://www.youtube.com/embed/TFnIEOks9EM"" frameborder=""1"" allowfullscreen></iframe>",,,,,,,,
80,Dividing Whole Measurements of Liquid Volume Solving for an Unknown,,Learning to solve for unknowns in division problems involving liquid volume in Grade 3 reinforces division skills. Students will explore how to find the unknown value in a division problem involving liquid volume,Learn to solve for unknowns in division problems involving liquid volume,publish,Solving Problems Involving Masses or Volumes,,,,,,,"<iframe width=""853"" height=""480"" src=""https://www.youtube.com/embed/7SuS00a4Bng"" frameborder=""1"" allowfullscreen></iframe>",,,,,,,,
81,Multiplying Whole Measurements of Volume,,Understanding how to multiply whole measurements of volume in Grade 3 enhances multiplication skills in real-world applications. Students will learn to multiply volumes of different objects,Understand how to multiply whole measurements of volume,publish,Solving Problems Involving Masses or Volumes,,,,,,,"<iframe width=""853"" height=""480"" src=""https://www.youtube.com/embed/8-34q0tNmUs"" frameborder=""1"" allowfullscreen></iframe>",,,,,,,,
82,Representing Data by Drawing Pictographs,,Learning to represent data visually by drawing pictographs in Grade 3 enhances data interpretation skills. Students will create pictographs to visually represent data,Learn to represent data visually by drawing pictographs,publish,Pictographs and Bar Graphs,,,,,,,"<iframe width=""853"" height=""480"" src=""https://www.youtube.com/embed/mSk5MnkHJao"" frameborder=""1"" allowfullscreen></iframe>",,,,,,,,
83,Representing Data by Creating Bar Graph,,Exploring how to create bar graphs to represent data in Grade 3 reinforces skills in data visualization. Students will construct bar graphs to visually represent data,Explore how to create bar graphs to represent data,publish,Pictographs and Bar Graphs,,,,,,,"<iframe width=""853"" height=""480"" src=""https://www.youtube.com/embed/ReW4MPqXTvA"" frameborder=""1"" allowfullscreen></iframe>",,,,,,,,
84,Drawing Detailed Bar Graphs,,Learning to draw detailed bar graphs in Grade 3 enhances skills in data representation and analysis. Students will create bar graphs with detailed data representations,Learn to draw detailed bar graphs,publish,Pictographs and Bar Graphs,,,,,,,"<iframe width=""853"" height=""480"" src=""https://www.youtube.com/embed/qzEaaSnWIUA"" frameborder=""1"" allowfullscreen></iframe>",,,,,,,,
85,Reading Data in Bar Graphs Drawn on a Grid,,Understanding how to read data in bar graphs drawn on a grid in Grade 3 reinforces data interpretation skills. Students will learn to extract information from bar graphs drawn on a grid,Understand how to read data in bar graphs drawn on a grid,publish,Pictographs and Bar Graphs,,,,,,,"<iframe width=""853"" height=""480"" src=""https://www.youtube.com/embed/3j6onkcBjyQ"" frameborder=""1"" allowfullscreen></iframe>",,,,,,,,
86,Reading Data in Bar Graphs,,Learning to read and interpret data in bar graphs in Grade 3 enhances skills in data analysis. Students will explore how to analyze and interpret bar graphs,Learn to read and interpret data in bar graphs,publish,Pictographs and Bar Graphs,,,,,,,"<iframe width=""853"" height=""480"" src=""https://www.youtube.com/embed/nGDYjEJCHUM"" frameborder=""1"" allowfullscreen></iframe>",,,,,,,,
87,Squares and Rectangles,,Exploring the properties of squares and rectangles in Grade 3 enhances understanding of geometric shapes. Students will learn the unique properties of squares and rectangles,Explore the properties of squares and rectangles,publish,Geometry,,,,,,,"<iframe width=""853"" height=""480"" src=""https://www.youtube.com/embed/ZDSlmq9N5k4"" frameborder=""1"" allowfullscreen></iframe>",,,,,,,,
88,Squares and Rhombi,,Learning about the properties of squares and rhombi in Grade 3 reinforces understanding of geometric relationships. Students will explore the similarities and differences between squares and rhombi,Learn about the properties of squares and rhombi,publish,Geometry,,,,,,,"<iframe width=""853"" height=""480"" src=""https://www.youtube.com/embed/NfFVjPivAc8"" frameborder=""1"" allowfullscreen></iframe>",,,,,,,,
89,Quadrilaterals,,Understanding the properties of quadrilaterals in Grade 3 enhances knowledge of various geometric shapes. Students will explore the unique characteristics of quadrilaterals,Understand the properties of quadrilaterals,publish,Geometry,,,,,,,"<iframe width=""853"" height=""480"" src=""https://www.youtube.com/embed/_cVhFLA_p74"" frameborder=""1"" allowfullscreen></iframe>",,,,,,,,
90,Breaking Shapes into Equal Parts,,Learning to break shapes into equal parts in Grade 3 reinforces understanding of fractions and division in geometry. Students will explore how to divide geometric shapes into equal parts,Learn to break shapes into equal parts,publish,Geometry,,,,,,,"<iframe width=""853"" height=""480"" src=""https://www.youtube.com/embed/M3isJ0IQUpY"" frameborder=""1"" allowfullscreen></iframe>",,,,,,,,
91,Drawing and Reading Simple Line Plots,,Exploring how to draw and read simple line plots in Grade 3 enhances skills in data representation. Students will create line plots to visually represent data,Explore how to draw and read simple line plots,publish,Line Plots,,,,,,,"<iframe width=""853"" height=""480"" src=""https://www.youtube.com/embed/yPVOdQ0CdEs"" frameborder=""1"" allowfullscreen></iframe>",,,,,,,,
92,Organizing Fractional Length Measurement Data,,Learning to organize fractional length measurement data using line plots in Grade 3 reinforces data analysis skills. Students will utilize line plots to organize and analyze data involving fractional lengths,Learn to organize fractional length measurement data using line plots,publish,Line Plots,,,,,,,"<iframe width=""853"" height=""480"" src=""https://www.youtube.com/embed/ZBA_uSBsFd0"" frameborder=""1"" allowfullscreen></iframe>",,,,,,,,
93,Representing Fractional Length Measurements with Line Plots,,Understanding how to represent fractional length measurements using line plots in Grade 3 enhances skills in data visualization. Students will create line plots to visually represent data involving fractions,Understand how to represent fractional length measurements using line plots,publish,Line Plots,,,,,,,"<iframe width=""853"" height=""480"" src=""https://www.youtube.com/embed/MwsO_9Se1sc"" frameborder=""1"" allowfullscreen></iframe>",,,,,,,,
94,Unit Squares for Measuring Area of Figures,,Learning to use unit squares to measure the area of figures in Grade 3 reinforces the understanding of area concepts. Students will utilize unit squares to calculate the area of various figures,Learn to use unit squares to measure the area of figures,publish,Area,,,,,,,"<iframe width=""853"" height=""480"" src=""https://www.youtube.com/embed/M0mlojwL9vA"" frameborder=""1"" allowfullscreen></iframe>",,,,,,,,
